<?xml version="1.0" encoding="UTF-8"?>
<mdq:check xmlns:mdq="https://nceas.ucsb.edu/mdqe/v1"
	xmlns:xsi="http://www.w3.org/2001/XMLSchema-instance"
	xsi:schemaLocation="https://nceas.ucsb.edu/mdqe/v1 ../schemas/schema1.xsd">
	<id>check.methods.present.1</id>
	<name>Methods</name>
	<description>All datasets should contain a methods section or a link to a separate methods document.</description>
	<type>interpretation</type>
	<level>REQUIRED</level>
	<environment>rscript</environment>
	<code><![CDATA[
  library(metadig)

  check <- function() {
      badStepCount <- 0
      # Recommended minimum word count
      minWordCount <- 7
      # Recommended maximum word count
      maxWordCount <- 20

      # Check that a methods section is present for the dataset
      if (!methodsPresent) {
          return(list(status = "FAILURE",
                      output = "A methods section is not present, so unable to check method step description word lengths."))
      }

      if (methodStepCount > 0) {
          for (iDescr in 1:length(methodStepDescription)) {
              thisDescr <- methodStepDescription[[iDescr]]
              wordCount <- length(unlist(strsplit(thisDescr, "\\s+", perl = TRUE)))
              if (wordCount < minWordCount) {
                  badStepCount <- badStepCount + 1
              }
          }
      } else {
          # No methodSteps defined (shouldn't happen, it's a required element for methods)
          return(list(status = "FAILURE",
                      output = "No method step descriptions are present."))
      }

      if (badStepCount > 0) {
          return(list(status = "FAILURE",
                      output = sprintf("%d of %d method step descriptions have fewer than the minimum recommended %d words.", badStepCount, methodStepCount, minWordCount)))
      } else {
          return(list(status = "SUCCESS",
                      output = sprintf("All method step descriptions are at least %d words long.", minWordCount)))
      }
  }

  result <- check()

  mdq_result <- list(status = result$status,
                     output = list(list(value = result$output)))
  ]]></code>
	<selector>
		<name>methodsPresent</name>
		<xpath>boolean(/eml/dataset/methods)</xpath>
	</selector>
	<selector>
		<name>methodStepCount</name>
		<xpath>count(/eml/dataset/methods/methodStep)</xpath>
	</selector>
	<selector>
		<name>methodStepDescription</name>
		<xpath>/eml/dataset/methods/methodStep</xpath>
		<subSelector>
			<name>msd</name>
			<xpath>./description//para/text()</xpath>
		</subSelector>
	</selector>
	<dialect>
		<name>eml</name>
		<xpath>boolean(/*[local-name() = 'eml'])</xpath>
	</dialect>
</mdq:check>
