<?xml version="1.0" encoding="UTF-8"?>
<mdq:check xmlns:mdq="https://nceas.ucsb.edu/mdqe"
	xmlns:xsi="http://www.w3.org/2001/XMLSchema-instance"
	xsi:schemaLocation="https://nceas.ucsb.edu/mdqe ../schemas/schema1.xsd">
	<id>check.attribute.definitions.differ.1</id>
	<name>Attribute name differs from attribute description.</name>
	<description>Check that each entity name and definition are not identical.</description>
	<type>interpretation</type>
	<level>REQUIRED</level>
	<environment>rscript</environment>
	<code><![CDATA[
check <- function() {
  library(base)
  # varialbe defined by MQE from the <xpath> selectors.
  # "attributeName" - the names of each data entity
  # "attributeDefinition" - the names of each data entity
  
  values <- list()
  attrCount <- 0
  if (length(attributeName) > 0) {
    for(iAttr in 1:length(attributeName)) {
      attrName <- tolower(as.character(attributeName[[iAttr]]))
      attrDef <- tolower(as.character(attributeDefinition[[iAttr]]))
      if(!is.na(attrName) && !is.na(attrDef)) {
        attrCount <- attrCount + 1
        if(attrName == attrDef) {
          values[[length(values)+1]] <- attributeName[[iAttr]]
        }
      }
    }
  }
  
  quoteStyle <- getOption("useFancyQuotes")
  options("useFanceyQuotes" = FALSE)
  
  if(length(values) > 0) {
    return(list(status="FAILURE", values=list(value=sprintf("These attributes have identical names and definitions: %s", paste(sQuote(unlist(values)), collapse=", ")))))
  } else {
    return(list(status="SUCCESS", values=list(value=sprintf("All %d attributes have valid definitions", attrCount))))
  }

  options("useFancyQuotes" = quoteStyle)
}

result <- check()
mdq_result <- list(status=result$status, output=list(result$values))
]]></code>

	<!-- Don't need a subSelector for entityName, as this element is required, 
		so their won't be entities that are selected that don't have this value, 
		and therefor no 'blank' values. -->
	<selector>
		<name>attributeName</name>
		<xpath>/eml/dataset/dataTable/attributeList/attribute</xpath>
		<subSelector>
			<name>attributeNameSubSelector</name>
			<xpath>./attributeName</xpath>
		</subSelector>
	</selector>
	<selector>
		<name>attributeDefinition</name>
		<xpath>/eml/dataset/dataTable/attributeList/attribute</xpath>
		<subSelector>
			<name>attributeDefinitionSubSelector</name>
			<xpath>./attributeDefinition</xpath>
		</subSelector>
	</selector>
	<dialect>
		<name>eml</name>
		<xpath>boolean(/*[local-name() = 'eml'])</xpath>
	</dialect>
</mdq:check>
